{
  "id": "2",
  "name": "Sample",
  "cover_image": "https://camo.githubusercontent.com/4f1c7189be171d34a36011cb48f165c4023850598a07e4c9c826531b6705b77e/68747470733a2f2f636c6f75642e676f6f676c652e636f6d2f636f64652f646f63732f7673636f64652f696d616765732f6372656174652d6e65772d6170702e676966",
  "description": "Get started with DevZero! This is a sample recipe containing node. There are also a few spiders in here. Not poisonous ones, mind you, but they do look scary and they're a little mad. Try not to make any sudden movemen- oh no. There were supposed to be 8 in here and I only count 7",
  "repos": [
    {
      "name": "devzero-website",
      "repo_url": "https://github.com/devzero-inc/devzero-website"
    }
  ],
  "author": {
    "name": "DevZero"
  },
  "packages": ["nodejs-16_x", "pnpm-7_x", "openssl"],
  "commands": [
    {
      "shell": "pnpm i --frozen-lockfile",
      "name": "install cmd",
      "directory": "nextjs-pg"
    }
  ]
}
